<?xml version="1.0" encoding="UTF-8"?>
<reservations xmlns:xsi="http://www.w3.org/2001/XMLSchema-instance" xsi:noNamespaceSchemaLocation="reservationsDB.xsd">
    <reservation>
        <username/>
        <dateFrom>2018-01-23</dateFrom>
        <dateTo>2018-02-12</dateTo>
        <timeFrom>13:50:00</timeFrom>
        <timeTo>14:50:00</timeTo>
        <note/>
        <entityID>R002</entityID>
    </reservation>
    <reservation>
        <username/>
        <dateFrom>2018-11-23</dateFrom>
        <dateTo>2018-11-30</dateTo>
        <timeFrom>09:00:00</timeFrom>
        <timeTo>12:00:00</timeTo>
        <note/>
        <entityID>E034</entityID>
    </reservation>
    <reservation>
        <username>Peter</username>
        <dateFrom>2018-03-11</dateFrom>
        <dateTo>2018-03-11</dateTo>
        <timeFrom>00:00:00</timeFrom>
        <timeTo>00:02:00</timeTo>
        <note>qwer</note>
        <entityID>E001</entityID>
    </reservation>
    <reservation>
        <username>Peter</username>
        <dateFrom>2018-03-11</dateFrom>
        <dateTo>2018-03-11</dateTo>
        <timeFrom>00:00:00</timeFrom>
        <timeTo>00:02:00</timeTo>
        <note>asdf</note>
        <entityID>E001</entityID>
    </reservation>
    <reservation>
        <username>Peter</username>
        <dateFrom>2018-03-11</dateFrom>
        <dateTo>2018-03-11</dateTo>
        <timeFrom>00:00:00</timeFrom>
        <timeTo>00:02:00</timeTo>
        <note>asdf</note>
        <entityID>E001</entityID>
    </reservation>
    <reservation>
        <username>Peter</username>
        <dateFrom>2018-03-11</dateFrom>
        <dateTo>2018-03-11</dateTo>
        <timeFrom>00:00:00</timeFrom>
        <timeTo>00:02:00</timeTo>
        <note>asdf1</note>
        <entityID>E001</entityID>
    </reservation>
<reservation><username>Peter</username><dateFrom>2018-03-11</dateFrom><dateTo>2018-03-11</dateTo><timeFrom>00:00:00</timeFrom><timeTo>00:02:00</timeTo><note>asdf</note><entityID>E001</entityID></reservation></reservations>
